### ISSUE TITLE
[BUG] Crowdsec bouncer plugin not communicating with LAPI

### ISSUE THREAD

**Issue by martinsarrionandia** [maxlerebourg/crowdsec-bouncer-traefik-plugin#200]
**Describe the bug** 🐛
Hi,

   I am trying to setup Crowdsec on kubernetes with traefik (ARM64). The engine is working and detecting attacks. However the traefik plugin is not performing the BAN action.

The logs suggest that the plugin is loaded.

```
2024-12-02T23:17:10Z INF Loading plugins... plugins=["crowdsec-bouncer-traefik-plugin","rewrite-body"]
2024-12-02T23:17:10Z INF Plugins loaded. plugins=["crowdsec-bouncer-traefik-plugin","rewrite-body"]
```

However It doesn't look like there is any communication from the traefik POD

```
crowdsec-lapi-5855c5b466-z97m6:/# cscli bouncer list
─────────────────────────────────────────────────────────────────────
 Name     IP Address  Valid  Last API pull  Type  Version  Auth Type 
─────────────────────────────────────────────────────────────────────
 traefik              :heavy_check_mark:                                   api-key   
─────────────────────────────────────────────────────────────────────
crowdsec-lapi-5855c5b466-z97m6:/# cscli bouncer inspect traefik
───────────────────────────────────────────────────────
 Bouncer: traefik                                      
───────────────────────────────────────────────────────
 Created At    2024-12-02 22:14:21.571134718 +0000 UTC 
 Last Update   2024-12-02 22:14:21.571135111 +0000 UTC 
 Revoked?      false                                   
 IP Address                                            
 Type                                                  
 Version                                               
 Last Pull                                             
 Auth type     api-key                                 
 OS            ?                                       
 Auto Created  false
```

This is confirmed with a tcpdump. It shows that communication is possible.

FROM the traefik POD;

```bash
~ $ ifconfig eth0
eth0      Link encap:Ethernet  HWaddr 62:2C:B9:EC:DF:1C
          inet addr:10.42.0.51  Bcast:10.42.0.255  Mask:255.255.255.0
          inet6 addr: fe80::602c:b9ff:feec:df1c/64 Scope:Link
          UP BROADCAST RUNNING MULTICAST  MTU:8951  Metric:1
          RX packets:152450 errors:0 dropped:0 overruns:0 frame:0
          TX packets:126492 errors:0 dropped:0 overruns:0 carrier:0
          collisions:0 txqueuelen:0
          RX bytes:297133391 (283.3 MiB)  TX bytes:288416051 (275.0 MiB)

~ $ wget http://crowdsec-service.crowdsec:8080
Connecting to crowdsec-service.crowdsec:8080 (10.43.34.98:8080)
wget: server returned error: HTTP/1.1 404 Not Found

404 is expected, it's just a test. I have no idea what the endpoint API format is.
```

TCPDUMP on the crowdsec POD

```bash
kubectl debug -n crowdsec -i crowdsec-lapi-5855c5b466-z97m6 --image=nicolaka/netshoot --target=crowdsec-lapi -- tcpdump host 10.42.0.51
Targeting container "crowdsec-lapi". If you don't see processes from this container it may be because the container runtime doesn't support this feature.
Defaulting debug container name to debugger-fjd2g.
If you don't see a command prompt, try pressing enter.
10:31:06.815659 IP 10-42-0-51.traefik.traefik.svc.cluster.local.57326 > crowdsec-lapi-5855c5b466-z97m6.8080: Flags [S], seq 516312827, win 62377, options [mss 8911,sackOK,TS val 1954361092 ecr 0,nop,wscale 7], length 0
10:31:06.815697 IP crowdsec-lapi-5855c5b466-z97m6.8080 > 10-42-0-51.traefik.traefik.svc.cluster.local.57326: Flags [S.], seq 52824467, ack 516312828, win 62293, options [mss 8911,sackOK,TS val 3339927364 ecr 1954361092,nop,wscale 7], length 0
10:31:06.815720 IP 10-42-0-51.traefik.traefik.svc.cluster.local.57326 > crowdsec-lapi-5855c5b466-z97m6.8080: Flags [.], ack 1, win 488, options [nop,nop,TS val 1954361092 ecr 3339927364], length 0
10:31:06.815782 IP 10-42-0-51.traefik.traefik.svc.cluster.local.57326 > crowdsec-lapi-5855c5b466-z97m6.8080: Flags [P.], seq 1:107, ack 1, win 488, options [nop,nop,TS val 1954361092 ecr 3339927364], length 106: HTTP: GET / HTTP/1.1
10:31:06.815788 IP crowdsec-lapi-5855c5b466-z97m6.8080 > 10-42-0-51.traefik.traefik.svc.cluster.local.57326: Flags [.], ack 107, win 486, options [nop,nop,TS val 3339927364 ecr 1954361092], length 0
10:31:06.816082 IP crowdsec-lapi-5855c5b466-z97m6.8080 > 10-42-0-51.traefik.traefik.svc.cluster.local.57326: Flags [P.], seq 1:102, ack 107, win 486, options
```

**Expected behavior** 👀

There should be some communication attempt from the traefik POD to the crowdsec POD. When I conduct the test above I can see traffic. At all other times there is none.

Log is set to DEBUG, but there don't appear to be any plugin logs in the traefik pod other than plugin loaded (above)

Here are the configurations;

```terraform
resource "helm_release" "traefik" {
  namespace  = "traefik"
  name       = "traefik"
  repository = "https://traefik.github.io/charts"
  chart      = "traefik"
  version    = "33.1.0-rc1"
  values     = [local.traefik-helm-manifest]
  replace    = true
  force_update = true
  upgrade_install = true
}

locals {
  traefik-helm-manifest = <<EOF
deployment:
  additionalVolumes:
  - name: plugins
    persistentVolumeClaim:
      claimName: "${kubernetes_persistent_volume_claim.traefik_plugins.metadata.0.name}"
additionalVolumeMounts:
- name: plugins
  mountPath: /plugins-storage
securityContext:
  privileged: true
  allowPrivilegeEscalation: true
  capabilities:
    drop:
    add: [ALL]
  seccompProfile:
    type: RuntimeDefault 
providers:
  kubernetesCRD:
    enabled: true
logs:
  general:
    level: "${var.traefik-log-level}"
  access:
    enabled: ${var.traefik-access-log}
service:
  spec:
    externalTrafficPolicy: "${var.traefik-external-access-policy}"
experimental:
  plugins:
    rewrite-body:
      moduleName: "github.com/packruler/rewrite-body"
      version: "v1.2.0"
    crowdsec-bouncer-traefik-plugin:
      moduleName: "github.com/maxlerebourg/crowdsec-bouncer-traefik-plugin"
      version: "v1.3.5"
EOF
}
```

```terraform
resource "helm_release" "crowdsec" {
  namespace  = var.crowdsec-namespace
  name       = var.crowdsec-name
  repository = "https://crowdsecurity.github.io/helm-charts"
  chart      = "crowdsec"
  values     = [local.crowdsec-helm-values]

  set {
    name  = "agent.resources.limits.memory"
    value = "250Mi"
  }

  set {
    name  = "agent.resources.limits.cpu"
    value = "500m"
  }

  set {
    name  = "agent.resources.requests.cpu"
    value = "50m"
  }

  set {
    name  = "agent.resources.requests.memory"
    value = "250Mi"
  }
}

resource "kubernetes_manifest" "crowdsec-middlewarre" {
  manifest = yamldecode(local.crowdsec-middleware-config)
}

locals {

  crowdsec-middleware-config = <<EOF
apiVersion: traefik.io/v1alpha1
kind: Middleware
metadata:
  name: bouncer
  namespace: traefik
spec:
  plugin:
    bouncer:
      enabled: true
      crowdsecMode: stream
      lapi: enabled
      crowdsecLapiScheme: http
      crowdsecLapiHost: ${var.crowdsec-name}-service.${var.crowdsec-namespace}:8080
      CrowdsecLapiKey: "${jsondecode(data.aws_secretsmanager_secret_version.rancher-current.secret_string)["bouncer-key-traefik"]}"
      crowdsecAppsecEnabled: false
      logLevel: DEBUG

EOF

  crowdsec-helm-values = <<EOF
# for raw logs format: json or cri (docker|containerd)
container_runtime: containerd
agent:
  # Specify each pod whose logs you want to process
  acquisition:
    # The namespace where the pod is located
    - namespace: traefik
      # The pod name
      podName: traefik-*
      # as in crowdsec configuration, we need to specify the program name to find a matching parser
      program: traefik
  env:
    - name: COLLECTIONS
      value: "crowdsecurity/traefik"
lapi:
  dashboard:
    enabled: false
    image:
      repository: apollof/crowdsec_metabase
      tag: latest
  env:
    # To enroll the Security Engine to the console
    - name: ENROLL_KEY
      value: "${jsondecode(data.aws_secretsmanager_secret_version.rancher-current.secret_string)["crowdsec-enroll-key"]}"
    - name: ENROLL_INSTANCE_NAME
      value: "${data.terraform_remote_state.rancher-infra.outputs.fqdn}"
    - name: ENROLL_TAGS
      value: "rancher"
    - name: BOUNCER_KEY_traefik
      value: "${jsondecode(data.aws_secretsmanager_secret_version.rancher-current.secret_string)["bouncer-key-traefik"]}"
  resources:
    limits:
      cpu: 500m
      memory: 500Mi
    requests:
      cpu: 50m
      memory: 250Mi
appsec:
  enable: true


EOF

}
```

```terraform
variable "cluster-issuer" {
  type    = string
  default = "letsencrypt"
}

variable "amazon-ebs-class" {
  type    = string
  default = "amazon-ebs"
}

variable "external-dns-name" {
  type    = string
  default = "external-dns"
}

variable "crowdsec-name" {
  type    = string
  default = "crowdsec"
}

variable "crowdsec-namespace" {
  type    = string
  default = "crowdsec"
}

variable "crowdsec-privileged" {
  type    = bool
  default = "true"
}

variable "traefik-log-level" {
  type    = string
  default = "INFO"
  #default = "DEBUG"
}

variable "traefik-access-log" {
  type    = bool
  default = "true"
}

variable "traefik-external-access-policy" {
  description = "Set to Local for middleware IP Whitelist to work"
  type        = string
  default     = "Local"
}
```

**Version (please complete the following information):**
 - OS: Centos 9 / Kubernetes v1.30.6+k3s1 arm64
 - Traefik version: traefik:v3.2.1
 - Plugin version: 1.6.5
 - Redis ? : Nope

**To Reproduce**

Apply terraform

Will do!

**Comment by mathieuHa** [comment]
Hi @martinsarrionandia,

Could you enable the plugin debug logs and provide them from Traefik Start to some requests you make. 
In 90% of cases, this is enough to identify what is causing the communication issue.

Thanks in advance

**Comment by martinsarrionandia** [comment]
[traefik_logs.txt](https://github.com/user-attachments/files/18011873/traefik_logs.txt)

**Comment by martinsarrionandia** [comment]
<img width="503" alt="Screenshot 2024-12-11 at 19 03 03" src="https://github.com/user-attachments/assets/d79fb7e1-cac4-461e-b4d5-be047738c09a" />
<img width="1454" alt="Screenshot 2024-12-11 at 19 44 23" src="https://github.com/user-attachments/assets/fa36b4ab-43f7-4c53-854c-37c6517a5d01" />

**Comment by martinsarrionandia** [comment]
@mathieuHa Hi, any ideas why there is no crd for the plugin type bouncer and where I can find it?

**Comment by martinsarrionandia** [comment]
Even though the logs state that the plugin is loaded. I really don't think it is.

**Comment by martinsarrionandia** [comment]
Ok I've found the problem. It's basically documentation from the Traefik website and various other sources.  The plugin MUST be labelled **bouncer** as below. 

experimental:
  plugins:
    rewrite-body:
      moduleName: "github.com/packruler/rewrite-body"
      version: "v1.2.0"
    **_bouncer:_**
      moduleName: "github.com/maxlerebourg/crowdsec-bouncer-traefik-plugin"
      version: "v1.3.5"

And definitely not crowdsec-bouncer-traefik-plugin: like this;

[Plugin Documentation](https://plugins.traefik.io/plugins/6335346ca4caa9ddeffda116/crowdsec-bouncer-traefik-plugin)

**Comment by maxlerebourg** [comment]
Good job here, it is a classic error for Traefik config.
I close the issue 👍
